ID,Category,Name,Description,Year,Link,License,PDF
6670830,cv,License Plate Dataset,1695 images for license plate detection,2025,https://www.kaggle.com/datasets/ronakgohil/license-plate-dataset,CC0: Public Domain,Kaggle
6556263,cv,Smoke-Fire-Detection-YOLO,Smoke and Fire Detection Dataset for YOLO,2025,https://www.kaggle.com/datasets/sayedgamal99/smoke-fire-detection-yolo,CC0: Public Domain,Kaggle
6732047,cv,Bird vs Drone,Distinguishing the Skies: A Dataset for Drone vs Bird Classification,2025,https://www.kaggle.com/datasets/stealthknight/bird-vs-drone,MIT,Kaggle
6625317,cv,Low light animals,Images of Animals converted to low light condition,2025,https://www.kaggle.com/datasets/subratasarkar32/low-light-animals,Apache 2.0,Kaggle
6652053,cv,İNME VERİ SETİ (STROKE DATASET),TEKNOFEST 2021 ARTIFICIAL INTELLIGENCE DATASET IN HEALTH,2025,https://www.kaggle.com/datasets/orvile/inme-veri-seti-stroke-dataset,Other (specified in description),Kaggle
6573025,cv,Car Detection and Tracking Dataset,499     Images of Car Dataset with Text Annotation,2025,https://www.kaggle.com/datasets/amitkumargurjar/car-detection-and-tracking-dataset,CC0: Public Domain,Kaggle
6412205,cv,AI vs. Human-Generated Images,A Curated Dataset of AI-Generated and Authentic Images,2025,https://www.kaggle.com/datasets/alessandrasala79/ai-vs-human-generated-dataset,Apache 2.0,Kaggle
6582139,cv,IQ-OTH/NCCD Lung Cancer Dataset (Augmented),Augmented Lung Cancer CT Scan samples from Iraqi hospitals,2025,https://www.kaggle.com/datasets/subhajeetdas/iq-othnccd-lung-cancer-dataset-augmented,MIT,Kaggle
165566,cv,Brain MRI Images for Brain Tumor Detection,,2019,https://www.kaggle.com/datasets/navoneel/brain-mri-images-for-brain-tumor-detection,Data files © Original Authors,Kaggle
29561,cv,CelebFaces Attributes (CelebA) Dataset,Over 200k images of celebrities with 40 binary attribute annotations,2018,https://www.kaggle.com/datasets/jessicali9530/celeba-dataset,Other (specified in description),Kaggle
6697657,cv,Signature,Detects human signatures in legal and general documents,2025,https://www.kaggle.com/datasets/ultralytics/signature,GNU Affero General Public License 3.0,Kaggle
59760,cv,Animals-10,Animal pictures of 10 different categories taken from google images,2019,https://www.kaggle.com/datasets/alessiocorrado99/animals10,GPL 2,Kaggle
6709331,cv,PlantDoc,Efficient plant disease detection with YOLO-ready annotations,2025,https://www.kaggle.com/datasets/andresmgs/plantdec,Attribution 4.0 International (CC BY 4.0),Kaggle
23079,cv,ASL Alphabet,Image data set for alphabets in the American Sign Language ,2018,https://www.kaggle.com/datasets/grassknoted/asl-alphabet,GPL 2,Kaggle
6812365,cv,Eye Disease Image Dataset,A dataset of color fundus images of eye diseases,2025,https://www.kaggle.com/datasets/ruhulaminsharif/eye-disease-image-dataset,Attribution 4.0 International (CC BY 4.0),Kaggle
6743253,cv,Amini Cocoa Contamination Dataset,Can you develop a machine learning model to identify diseases on cocoa leaves?,2025,https://www.kaggle.com/datasets/ohagwucollinspatrick/amini-cocoa-contamination-dataset,Attribution 4.0 International (CC BY 4.0),Kaggle
6637588,cv,road_network_Detection_Mumbai_city_Dataset,High-resolution aerial images and binary masks of Mumbai City for road network ,2025,https://www.kaggle.com/datasets/yash0309/road-network-detection-mumbai-city-dataset,CC BY-SA 4.0,Kaggle
34662,cv,Fruit Images for Object Detection,Containing labelled fruit images to train object detection systems.,2018,https://www.kaggle.com/datasets/mbkinaci/fruit-images-for-object-detection,CC0: Public Domain,Kaggle
6591548,cv,Capsule Endoscopy Dataset (KAUHC),A Novel Small-Bowel Endoscopic Image Repository from Saudi Arabia,2025,https://www.kaggle.com/datasets/nisarahmedrana/capsule-endoscopy-dataset-kauhc,Apache 2.0,Kaggle
1340911,cv,Diabetic_Retinopathy_Balanced,Diabetic Retinopathy Dataset,2021,https://www.kaggle.com/datasets/kushagratandon12/diabetic-retinopathy-balanced,CC0: Public Domain,Kaggle
6694217,cv,3D printing process dataset,Dataset to use for computer vision and improvements on printing process,2025,https://www.kaggle.com/datasets/marcelobatalhah/full-extruded-dataset,MIT,Kaggle
26922,cv,Labelled Faces in the Wild (LFW) Dataset,"Over 13,000 images of faces collected from the web",2018,https://www.kaggle.com/datasets/jessicali9530/lfw-dataset,Other (specified in description),Kaggle
1447507,cv,Plant disease recognition dataset,Plant disease dataset,2021,https://www.kaggle.com/datasets/rashikrahmanpritom/plant-disease-recognition-dataset,CC0: Public Domain,Kaggle
952827,cv,Fruits and Vegetables Image Recognition Dataset,Fruit and Vegetable Images for Object Recognition,2022,https://www.kaggle.com/datasets/kritikseth/fruit-and-vegetable-image-recognition,CC0: Public Domain,Kaggle
2579480,cv,Cards Image Dataset-Classification,"53 classes 7624 train, 265 test, 265 validation images 224 X 224 X 3 jpg format",2022,https://www.kaggle.com/datasets/gpiosenka/cards-image-datasetclassification,CC0: Public Domain,Kaggle
30084,cv,Stanford Cars Dataset,"16,185 images and 196 classes of all the cars you'll ever dream of",2018,https://www.kaggle.com/datasets/jessicali9530/stanford-cars-dataset,Other (specified in description),Kaggle
601280,cv,Lung and Colon Cancer Histopathological Images,25000 images of 5 classes including lung and colon cancer and healthy samples.,2020,https://www.kaggle.com/datasets/andrewmvd/lung-and-colon-cancer-histopathological-images,CC BY-SA 4.0,Kaggle
839140,cv,Chest CT-Scan images Dataset,CT-Scan images with different types of chest cancer,2020,https://www.kaggle.com/datasets/mohamedhanyyy/chest-ctscan-images,"Database: Open Database, Contents: © Original Authors",Kaggle
843852,cv,Car Object Detection,YOLO Object Detection Playground | 1000+ Videos,2022,https://www.kaggle.com/datasets/sshikamaru/car-object-detection,Other (specified in description),Kaggle
31296,cv,Flickr Image dataset,Flickr Image captioning dataset,2018,https://www.kaggle.com/datasets/hsankesara/flickr-image-dataset,CC0: Public Domain,Kaggle
1817999,cv,Vegetable Image Dataset,Vegetable classification and recognition,2021,https://www.kaggle.com/datasets/misrakahmed/vegetable-image-dataset,CC BY-SA 4.0,Kaggle
19136,cv,LFW - People (Face Recognition),The Labeled Faces in the Wild face recognition dataset.,2019,https://www.kaggle.com/datasets/atulanandjha/lfwpeople,GNU Lesser General Public License 3.0,Kaggle
667889,cv,Face Mask Detection,853 images belonging to 3 classes.,2020,https://www.kaggle.com/datasets/andrewmvd/face-mask-detection,CC0: Public Domain,Kaggle
3829311,cv,Cats and Dogs Classification Dataset,The Cat and Dog Classification dataset is a standard computer vision dataset.,2023,https://www.kaggle.com/datasets/bhavikjikadara/dog-and-cat-classification-dataset,Apache 2.0,Kaggle
6622941,cv,Ships_data,Dataset of satellite ship images with TXT annotations for each photo,2025,https://www.kaggle.com/datasets/s4mik4dr/ships-data,"Database: Open Database, Contents: Database Contents",Kaggle
4066836,cv,Traffic Signs Detection,Signs Detection For Self-Driving Cars (Computer Vision Project),2024,https://www.kaggle.com/datasets/pkdarabi/cardetection,Attribution 4.0 International (CC BY 4.0),Kaggle
6734545,cv,"Facial Expression Recognition Dataset - 199,955","Dataset contains 199,955 images with different expressions from 28,565 people",2025,https://www.kaggle.com/datasets/unidatapro/facial-expression-recognition-dataset,Attribution-NonCommercial-NoDerivatives 4.0 International (CC BY-NC-ND 4.0),Kaggle
6696835,cv,Indonesia Traffic Sign Dataset - YOLOv11,"Trafic Signs Data for Over 15,000 Images ( With YOLOv11 Compability)",2025,https://www.kaggle.com/datasets/adityabayhaqie/indonesia-traffic-sign-dataset-yolov11,CC BY-SA 4.0,Kaggle
2049052,cv,Rice Image Dataset,"Five different Rice Image Dataset. Arborio, Basmati, Ipsala, Jasmine, Karacadag",2022,https://www.kaggle.com/datasets/muratkokludataset/rice-image-dataset,CC0: Public Domain,Kaggle
6617391,cv,APTOS 2019 (JPG),Detect diabetic retinopathy to stop blindness before it's too late,2025,https://www.kaggle.com/datasets/subhajeetdas/aptos-2019-jpg,Apache 2.0,Kaggle
1554380,cv,Animal Image Dataset (90 Different Animals),Zooming in on Wildlife: 5400 Animal Images Across 90 Diverse Classes,2022,https://www.kaggle.com/datasets/iamsouravbanerjee/animal-image-dataset-90-different-animals,Other (specified in description),Kaggle
701370,cv,EuroSAT,Land Use and Land Cover Classification with Sentinel-2 ,2020,https://www.kaggle.com/datasets/ryanholbrook/eurosat,Community Data License Agreement - Permissive - Version 1.0,Kaggle
617086,cv,TensorFlow Flowers,,2020,https://www.kaggle.com/datasets/ryanholbrook/tensorflow-flowers,Data files © Original Authors,Kaggle
177084,cv,American Sign Language Dataset ,American Sign Language Dataset for Image Classifcation,2019,https://www.kaggle.com/datasets/ayuraj/asl-dataset,CC0: Public Domain,Kaggle
6691299,cv,Lacuna Solar Survey Challenge,Can you identify solar panels and boilers in satellite and drone imagery?,2025,https://www.kaggle.com/datasets/kimp1995/lacuna-solar-survey-challenge,Unknown,Kaggle
1589971,cv,WLASL (World Level American Sign Language) Video,12k processed videos of Word-Level American Sign Language glossary performance,2021,https://www.kaggle.com/datasets/risangbaskoro/wlasl-processed,Other (specified in description),Kaggle
11102,cv,CIFAR-10 Python,Excellent for Keras and other Python kernels,2018,https://www.kaggle.com/datasets/pankrzysiu/cifar10-python,Other (specified in description),Kaggle
6768608,cv,spr-mmg-0,Dataset #0 for the SPR Screening Mammogram Challenge,2025,https://www.kaggle.com/datasets/felipekitamura/spr-mmg-1,CC BY-NC-SA 4.0,Kaggle
1343913,cv,Brian Tumor Dataset,X-Ray images of Brain,2021,https://www.kaggle.com/datasets/preetviradiya/brian-tumor-dataset,GPL 2,Kaggle
3442424,cv,Butterfly Image Classification,Identify the class to which each butterfly belongs to,2024,https://www.kaggle.com/datasets/phucthaiv02/butterfly-image-classification,CC0: Public Domain,Kaggle
6569697,cv,Crop Damage Classification Dataset (CDC Dataset),Binary Classification of Damaged vs Non-damaged Crop Images,2025,https://www.kaggle.com/datasets/tanvirnwu/crop-damage-classification-dataset-cdc-dataset,MIT,Kaggle
4296838,cv,Bone Fracture Detection: Computer Vision Project,Object Detection By YOLO,2024,https://www.kaggle.com/datasets/pkdarabi/bone-fracture-detection-computer-vision-project,Attribution 4.0 International (CC BY 4.0),Kaggle
930614,cv,CVC-ClinicDB,Dataset of Endoscopic Colonoscopy Frames for Polyp Detection,2020,https://www.kaggle.com/datasets/balraj98/cvcclinicdb,Other (specified in description),Kaggle
6734558,cv,"Infrared Face Recognition Dataset - 125,500+ image","Dataset contains 125,000 images, including infrared, from 4,484 individuals ",2025,https://www.kaggle.com/datasets/unidatapro/infrared-face-recognition-dataset,Attribution-NonCommercial-NoDerivatives 4.0 International (CC BY-NC-ND 4.0),Kaggle
3041726,cv,CIFAKE: Real and AI-Generated Synthetic Images,Can Computer Vision detect when images have been generated by AI?,2023,https://www.kaggle.com/datasets/birdy654/cifake-real-and-ai-generated-synthetic-images,Other (specified in description),Kaggle
6815819,cv,American Sign Language Dataset ,A diverse ASL dataset with multiple angles and landmark detection,2025,https://www.kaggle.com/datasets/iamavinashkr090502/asl-hand-landmark-and-gesture-dataset,CC BY-SA 4.0,Kaggle
6789413,cv,ShutterStock Dataset for AI vs Human-Gen. Image,Analyzing AI-Generated vs. Human-Created Images Using ShutterStock Data,2025,https://www.kaggle.com/datasets/shreyasraghav/shutterstock-dataset-for-ai-vs-human-gen-image,"Database: Open Database, Contents: Database Contents",Kaggle
6709844,cv,CitDet-YOLO,High-resolution citrus fruit dataset for detection and yield estimation.,2025,https://www.kaggle.com/datasets/andresmgs/citdet-yolo,Attribution 4.0 International (CC BY 4.0),Kaggle
6674576,cv,ULID25k, Unsplash Lite Image Dataset,2025,https://www.kaggle.com/datasets/chubercik/ulid25k,Other (specified in description),Kaggle
667852,cv,Animal Faces,"16,130 images belonging to 3 classes.",2020,https://www.kaggle.com/datasets/andrewmvd/animal-faces,Attribution-NonCommercial 4.0 International (CC BY-NC 4.0),Kaggle
